{
  "$schema": "https://paperandslate.org/schemas/eom/1.0/vocabulary-registry.schema.json",
  "specification": "https://paperandslate.org/spec/eom/1.0",
  "version": "1.0",
  "id": "https://paperandslate.org/eom/registries/vocabularies/1.0",
  "canonical": "https://paperandslate.org/eom/registries/vocabularies/1.0",
  "type": "vocabulary-registry",
  "status": "working-draft",
  "changeController": "https://paperandslate.org/governance/eom",
  "lastReviewed": "2026-08-26",
  "vocabularies": [
    {
      "vocabularyUri": "https://paperandslate.org/vocabularies/eom/organization-types",
      "category": "organization-types",
      "title": "Organization types",
      "description": "Open organization classifications used to describe publishers and educational bodies.",
      "currentVersion": "1.0",
      "compatibleProtocolVersions": ["1.0"],
      "status": "working-draft",
      "openness": "extensible",
      "controller": "https://paperandslate.org/governance/eom",
      "schema": "https://paperandslate.org/schemas/eom/1.0/vocabulary.schema.json",
      "snapshot": "https://paperandslate.org/vocabularies/eom/1.0/organization-types.json",
      "mappings": ["schema.org/Organization"],
      "lastReviewed": "2026-08-26"
    },
    {
      "vocabularyUri": "https://paperandslate.org/vocabularies/eom/education-levels",
      "category": "education-levels",
      "title": "Education levels",
      "description": "Open education-level references; local and jurisdiction-specific values remain valid.",
      "currentVersion": "1.0",
      "compatibleProtocolVersions": ["1.0"],
      "status": "working-draft",
      "openness": "open",
      "controller": "https://paperandslate.org/governance/eom",
      "schema": "https://paperandslate.org/schemas/eom/1.0/vocabulary.schema.json",
      "snapshot": "https://paperandslate.org/vocabularies/eom/1.0/education-levels.json",
      "mappings": ["ISCED-F 2013"],
      "lastReviewed": "2026-08-26"
    },
    {
      "vocabularyUri": "https://paperandslate.org/vocabularies/eom/course-subjects",
      "category": "course-subjects",
      "title": "Course subjects",
      "description": "Extensible subject references for course and program classification.",
      "currentVersion": "1.0",
      "compatibleProtocolVersions": ["1.0"],
      "status": "working-draft",
      "openness": "open",
      "controller": "https://paperandslate.org/governance/eom",
      "schema": "https://paperandslate.org/schemas/eom/1.0/vocabulary.schema.json",
      "snapshot": "https://paperandslate.org/vocabularies/eom/1.0/course-subjects.json",
      "mappings": ["CEDS subject"],
      "lastReviewed": "2026-08-26"
    },
    {
      "vocabularyUri": "https://paperandslate.org/vocabularies/eom/credit-systems",
      "category": "credit-systems",
      "title": "Credit systems",
      "description": "Credit-unit systems whose values are never assumed interchangeable.",
      "currentVersion": "1.0",
      "compatibleProtocolVersions": ["1.0"],
      "status": "working-draft",
      "openness": "extensible",
      "controller": "https://paperandslate.org/governance/eom",
      "schema": "https://paperandslate.org/schemas/eom/1.0/vocabulary.schema.json",
      "snapshot": "https://paperandslate.org/vocabularies/eom/1.0/credit-systems.json",
      "mappings": ["ECTS", "Carnegie Unit"],
      "lastReviewed": "2026-08-26"
    },
    {
      "vocabularyUri": "https://paperandslate.org/vocabularies/eom/academic-period-types",
      "category": "academic-period-types",
      "title": "Academic period types",
      "description": "Open period classifications for terms, semesters, sessions, blocks, and custom periods.",
      "currentVersion": "1.0",
      "compatibleProtocolVersions": ["1.0"],
      "status": "working-draft",
      "openness": "extensible",
      "controller": "https://paperandslate.org/governance/eom",
      "schema": "https://paperandslate.org/schemas/eom/1.0/vocabulary.schema.json",
      "snapshot": "https://paperandslate.org/vocabularies/eom/1.0/academic-period-types.json",
      "mappings": ["RFC 5545"],
      "lastReviewed": "2026-08-26"
    },
    {
      "vocabularyUri": "https://paperandslate.org/vocabularies/eom/delivery-modes",
      "category": "delivery-modes",
      "title": "Delivery modes",
      "description": "Extensible delivery-mode values for in-person, online, hybrid, and scheduled offerings.",
      "currentVersion": "1.0",
      "compatibleProtocolVersions": ["1.0"],
      "status": "working-draft",
      "openness": "extensible",
      "controller": "https://paperandslate.org/governance/eom",
      "schema": "https://paperandslate.org/schemas/eom/1.0/vocabulary.schema.json",
      "snapshot": "https://paperandslate.org/vocabularies/eom/1.0/delivery-modes.json",
      "mappings": ["schema.org/CourseInstance"],
      "lastReviewed": "2026-08-26"
    },
    {
      "vocabularyUri": "https://paperandslate.org/vocabularies/eom/facility-types",
      "category": "facility-types",
      "title": "Facility types",
      "description": "Public facility classifications with safety-reviewed publication boundaries.",
      "currentVersion": "1.0",
      "compatibleProtocolVersions": ["1.0"],
      "status": "working-draft",
      "openness": "open",
      "controller": "https://paperandslate.org/governance/eom",
      "schema": "https://paperandslate.org/schemas/eom/1.0/vocabulary.schema.json",
      "snapshot": "https://paperandslate.org/vocabularies/eom/1.0/facility-types.json",
      "mappings": ["schema.org/Place"],
      "lastReviewed": "2026-08-26"
    },
    {
      "vocabularyUri": "https://paperandslate.org/vocabularies/eom/service-types",
      "category": "service-types",
      "title": "Service types",
      "description": "Open public service classifications.",
      "currentVersion": "1.0",
      "compatibleProtocolVersions": ["1.0"],
      "status": "working-draft",
      "openness": "open",
      "controller": "https://paperandslate.org/governance/eom",
      "schema": "https://paperandslate.org/schemas/eom/1.0/vocabulary.schema.json",
      "snapshot": "https://paperandslate.org/vocabularies/eom/1.0/service-types.json",
      "mappings": ["schema.org/Service"],
      "lastReviewed": "2026-08-26"
    },
    {
      "vocabularyUri": "https://paperandslate.org/vocabularies/eom/sports",
      "category": "sports",
      "title": "Sports",
      "description": "Open sports and activity references.",
      "currentVersion": "1.0",
      "compatibleProtocolVersions": ["1.0"],
      "status": "working-draft",
      "openness": "open",
      "controller": "https://paperandslate.org/governance/eom",
      "schema": "https://paperandslate.org/schemas/eom/1.0/vocabulary.schema.json",
      "snapshot": "https://paperandslate.org/vocabularies/eom/1.0/sports.json",
      "mappings": ["schema.org/SportsActivityLocation"],
      "lastReviewed": "2026-08-26"
    },
    {
      "vocabularyUri": "https://paperandslate.org/vocabularies/eom/club-categories",
      "category": "club-categories",
      "title": "Club categories",
      "description": "Extensible categories for public student and community clubs without member rosters.",
      "currentVersion": "1.0",
      "compatibleProtocolVersions": ["1.0"],
      "status": "working-draft",
      "openness": "extensible",
      "controller": "https://paperandslate.org/governance/eom",
      "schema": "https://paperandslate.org/schemas/eom/1.0/vocabulary.schema.json",
      "snapshot": "https://paperandslate.org/vocabularies/eom/1.0/club-categories.json",
      "mappings": ["schema.org/Organization"],
      "lastReviewed": "2026-08-26"
    },
    {
      "vocabularyUri": "https://paperandslate.org/vocabularies/eom/meal-types",
      "category": "meal-types",
      "title": "Meal types and allergens",
      "description": "Public meal categories and allergen references; individual dietary records are out of scope.",
      "currentVersion": "1.0",
      "compatibleProtocolVersions": ["1.0"],
      "status": "working-draft",
      "openness": "extensible",
      "controller": "https://paperandslate.org/governance/eom",
      "schema": "https://paperandslate.org/schemas/eom/1.0/vocabulary.schema.json",
      "snapshot": "https://paperandslate.org/vocabularies/eom/1.0/meal-types.json",
      "mappings": ["USDA FoodData Central"],
      "lastReviewed": "2026-08-26"
    },
    {
      "vocabularyUri": "https://paperandslate.org/vocabularies/eom/transport-modes",
      "category": "transport-modes",
      "title": "Transport modes",
      "description": "Public, coarse-grained transportation modes and service types.",
      "currentVersion": "1.0",
      "compatibleProtocolVersions": ["1.0"],
      "status": "working-draft",
      "openness": "extensible",
      "controller": "https://paperandslate.org/governance/eom",
      "schema": "https://paperandslate.org/schemas/eom/1.0/vocabulary.schema.json",
      "snapshot": "https://paperandslate.org/vocabularies/eom/1.0/transport-modes.json",
      "mappings": ["GTFS"],
      "lastReviewed": "2026-08-26"
    },
    {
      "vocabularyUri": "https://paperandslate.org/vocabularies/eom/contact-roles",
      "category": "contact-roles",
      "title": "Contact roles",
      "description": "Role-based contact labels that avoid unnecessary personal data publication.",
      "currentVersion": "1.0",
      "compatibleProtocolVersions": ["1.0"],
      "status": "working-draft",
      "openness": "extensible",
      "controller": "https://paperandslate.org/governance/eom",
      "schema": "https://paperandslate.org/schemas/eom/1.0/vocabulary.schema.json",
      "snapshot": "https://paperandslate.org/vocabularies/eom/1.0/contact-roles.json",
      "mappings": ["schema.org/ContactPoint"],
      "lastReviewed": "2026-08-26"
    },
    {
      "vocabularyUri": "https://paperandslate.org/vocabularies/eom/document-categories",
      "category": "document-categories",